{
  "manifest_version": "vista-strongswan-experiment-v2",
  "dataset_id": "collection-6cbecc1a-2dc8-47e4-b96d-073a57d1530e",
  "feature_schema_version": "vista-flow-v1",
  "extractor_version": "vista-ml-pcap-features-v1",
  "observations": [
    {
      "experiment_id": "983c7137-097c-4f51-bbff-bb55aaf22d74",
      "session_id": "6cbecc1a-2dc8-47e4-b96d-073a57d1530e",
      "session_record_path": "session_record.json",
      "session_record_sha256": "c6804c7efed0aecfb22fc407fc1fcaa35506474c6ee0a0f5ab66d2b488d77662",
      "capture": {
        "path": "packets.csv",
        "format": "packet_table_csv",
        "sha256": "e975afd97c8277986e27d1c37bbe6ab4d575faa620cab325b71628dacdb1c05a",
        "started_at": "2026-10-10T03:06:09.228215+00:00",
        "completed_at": "2026-10-10T03:06:10.722793+00:00",
        "interface": "eth0",
        "capture_point": "outer",
        "ip_version": 4,
        "protocol_family": "ESP",
        "raw_pcap_path": "pc1_outer_icmp.pcap",
        "raw_pcap_format": "pcap",
        "raw_pcap_sha256": "10e09bf04ff7a655de773cc9b8485781e3f1db775192b8f358f02925e9819062",
        "raw_pcap_size_bytes": 980
      },
      "ground_truth": {
        "label": "controlled_icmpv4_echo",
        "record_path": "ground_truth.json",
        "record_sha256": "033b2e59ab544ea8390d7247ba70246fd00e00bcf748dc9f63622fe56c39dd56",
        "record_field": "label",
        "method": "Bounded ICMP echo generated by pc1; independently corroborated by pc2 receiver-side ICMP capture and sender ping counters.",
        "independently_verified": true
      },
      "workload": {
        "type": "icmpv4_echo",
        "configuration": {
          "profiles": [
            {
              "count": 3,
              "interval_seconds": 0.2,
              "payload_bytes": 64
            }
          ],
          "observed": {
            "packetsRequested": 3,
            "packetsSent": 3,
            "packetsReceived": 3,
            "senderDurationSeconds": 0.5940000000409782,
            "receiverEchoRequests": 3,
            "receiverEchoReplies": 0,
            "pc2CapturedIcmpPackets": 3,
            "pc1CapturedEspPackets": 4,
            "packetTablePackets": 0,
            "byteCount": 192,
            "icmpBytesSent": 216,
            "pc1CapturedIpv4Bytes": 592,
            "saCounterDelta": {
              "packetsIn": 3,
              "packetsOut": 3,
              "bytesIn": 276,
              "bytesOut": 276
            }
          }
        },
        "measurement_path": "workload_measurements.json",
        "measurement_sha256": "ec7229a30e365eb35d08e9ae6efe68ab306696b007342fbf271b4f57bd070d12"
      },
      "vpn": {
        "requested_configuration": {
          "source": "existing live testbed SA; collector does not reconfigure StrongSwan",
          "ipVersion": "IPv4",
          "mode": "tunnel"
        },
        "effective_configuration": {
          "ike": {
            "version": 2,
            "encryption": "AES_CBC",
            "encryptionKeySize": 256,
            "integrity": "HMAC_SHA2_256_128",
            "prf": "PRF_HMAC_SHA2_256",
            "dhGroup": 14,
            "dhGroupName": "MODP_2048"
          },
          "child": {
            "name": "pc-tunnel",
            "state": "INSTALLED",
            "mode": "TUNNEL",
            "protocol": "ESP",
            "encryption": "AES_GCM_16",
            "encryptionKeySize": 256,
            "integrity": null,
            "pfsGroup": 14,
            "pfsGroupName": "MODP_2048",
            "localTrafficSelector": "172.20.0.2/32",
            "remoteTrafficSelector": "172.20.0.3/32",
            "bytesIn": 4612,
            "bytesOut": 6788,
            "packetsIn": 59,
            "packetsOut": 67,
            "spiIn": "ca064433",
            "spiOut": "ce31899b"
          },
          "xfrmMode": "TUNNEL"
        },
        "negotiated_sa_evidence_path": "negotiated_sa.json",
        "negotiated_sa_evidence_sha256": "7fc8afd88b313318c89222a3e897ca7d778e74b00274647f00f080d2fbc23969"
      },
      "data_quality": {
        "status": "accepted",
        "reasons": []
      }
    }
  ]
}