{
  "manifest_version": "vista-strongswan-experiment-v2",
  "dataset_id": "collection-29eda4e7-6175-458e-b9b7-1ad8ecb4b702",
  "feature_schema_version": "vista-flow-v1",
  "extractor_version": "vista-ml-pcap-features-v1",
  "observations": [
    {
      "experiment_id": "2eff28ee-a9c1-44a4-b95b-81431f850dce",
      "session_id": "29eda4e7-6175-458e-b9b7-1ad8ecb4b702",
      "session_record_path": "session_record.json",
      "session_record_sha256": "a5f475b437664e343f5780e9f73a20e7609d3f30c1c0dc239e823de539e4d961",
      "capture": {
        "path": "packets.csv",
        "format": "packet_table_csv",
        "sha256": "44ebc3146f1bed618b6a02bd4069d63a86acaf7371823a65e1cb5326c6ae3b16",
        "started_at": "2026-10-10T05:55:01.974554+00:00",
        "completed_at": "2026-10-10T05:55:06.333506+00:00",
        "interface": "eth0",
        "capture_point": "outer",
        "ip_version": 4,
        "protocol_family": "ESP",
        "raw_pcap_path": "pc1_outer_http.pcap",
        "raw_pcap_format": "pcap",
        "raw_pcap_sha256": "c208ef3dee946181ed739d0b3d5c2e68c1a8b8dc4e9326d8b1895d586890732d",
        "raw_pcap_size_bytes": 11766
      },
      "ground_truth": {
        "label": "controlled_http_traffic",
        "record_path": "ground_truth.json",
        "record_sha256": "7287acb9338b063c1a3e9deb4652f96200d375e309dd60bc85466fa88a9c5198",
        "record_field": "label",
        "method": "Bounded HTTP/1.1 client/server exchange generated between pc1 and pc2 over IPsec tunnel; independently verified by pc2 server-side access evidence and pc1 outer ESP capture.",
        "independently_verified": true
      },
      "workload": {
        "type": "http_traffic",
        "configuration": {
          "profiles": [
            {
              "count": 5,
              "interval_seconds": 0.3,
              "path": "/api/v1/status",
              "method": "GET",
              "payload_bytes": 0,
              "expected_status": 200
            }
          ],
          "observed": {
            "requestsRequested": 5,
            "requestsSent": 5,
            "requestsReceivedByServer": 5,
            "bytesSent": 545,
            "bytesReceived": 400,
            "pc1CapturedEspPackets": 53,
            "pc2CapturedTcpPackets": 29,
            "saCounterDelta": {
              "packetsIn": 24,
              "packetsOut": 29,
              "bytesIn": 2188,
              "bytesOut": 2093
            }
          }
        },
        "measurement_path": "workload_measurements.json",
        "measurement_sha256": "1dc28fe1f96bfefcda911e15fd2bf675351a469f133a85b59c0d56cdb1960ccc"
      },
      "vpn": {
        "requested_configuration": {
          "source": "existing live testbed SA; collector does not reconfigure StrongSwan",
          "ipVersion": "IPv4",
          "mode": "tunnel"
        },
        "effective_configuration": {
          "ike": {
            "version": 2,
            "encryption": "AES_CBC",
            "encryptionKeySize": 256,
            "integrity": "HMAC_SHA2_256_128",
            "prf": "PRF_HMAC_SHA2_256",
            "dhGroup": 14,
            "dhGroupName": "MODP_2048"
          },
          "child": {
            "name": "pc-tunnel",
            "state": "INSTALLED",
            "mode": "TUNNEL",
            "protocol": "ESP",
            "encryption": "AES_GCM_16",
            "encryptionKeySize": 256,
            "integrity": null,
            "pfsGroup": 14,
            "pfsGroupName": "MODP_2048",
            "localTrafficSelector": "172.20.0.2/32",
            "remoteTrafficSelector": "172.20.0.3/32",
            "bytesIn": 894,
            "bytesOut": 1920,
            "packetsIn": 10,
            "packetsOut": 12,
            "spiIn": "c4be709e",
            "spiOut": "c38b9d77"
          },
          "xfrmMode": "TUNNEL"
        },
        "negotiated_sa_evidence_path": "negotiated_sa.json",
        "negotiated_sa_evidence_sha256": "f631458fcac5e9294a61cdf6b2a11ec5730f66a936548cfe634f2c0544979360"
      },
      "data_quality": {
        "status": "accepted",
        "reasons": []
      }
    }
  ]
}