{
  "manifest_version": "vista-strongswan-experiment-v2",
  "dataset_id": "collection-e61b0386-22f5-40e3-a187-002df8b4d9a0",
  "feature_schema_version": "vista-flow-v1",
  "extractor_version": "vista-ml-pcap-features-v1",
  "observations": [
    {
      "experiment_id": "9870c4f3-6127-4efe-b661-fe62a5713d21",
      "session_id": "e61b0386-22f5-40e3-a187-002df8b4d9a0",
      "session_record_path": "9870c4f3-6127-4efe-b661-fe62a5713d21/session_record.json",
      "session_record_sha256": "0d761331f3e5606eff63c92231e92a1051e0f2c170dc77f91643938a199e5658",
      "capture": {
        "path": "9870c4f3-6127-4efe-b661-fe62a5713d21/packets.csv",
        "format": "packet_table_csv",
        "sha256": "6b0119f7ff87ae01eb980670b2003fb4b9ce417e47757486c7a4708d83b6f3f0",
        "started_at": "2026-10-10T12:45:45.531081+00:00",
        "completed_at": "2026-10-10T12:45:49.067472+00:00",
        "interface": "eth0",
        "capture_point": "outer",
        "ip_version": 4,
        "protocol_family": "ESP",
        "raw_pcap_path": "9870c4f3-6127-4efe-b661-fe62a5713d21/pc1_outer_rtp.pcap",
        "raw_pcap_format": "pcap",
        "raw_pcap_sha256": "1fbaa609741e2ca551e9155e470e96927a6b5d3b1f7530b033617307edb90771",
        "raw_pcap_size_bytes": 5514
      },
      "ground_truth": {
        "label": "controlled_rtp_voip",
        "label_schema_version": "vista-target-label-schema-v2",
        "workload_subtype": "rtp_voip",
        "record_path": "9870c4f3-6127-4efe-b661-fe62a5713d21/ground_truth.json",
        "record_sha256": "2bb6dffde2b1bb1bf38ff9171bd4c274c45d9cdb968f1832f6839fe8db892636",
        "record_field": "label",
        "method": "Bounded RFC 3550 RTP/UDP voice-over-IP audio frames generated by pc1; pc2 independently receives, verifies sequence continuity, and hashes payload.",
        "independently_verified": true
      },
      "workload": {
        "type": "rtp_voip",
        "subtype": "rtp_voip",
        "configuration": {
          "profiles": [
            {
              "count": 15,
              "interval_seconds": 0.03,
              "payload_bytes": 240,
              "ssrc": 287454024,
              "payload_type": 0,
              "start_sequence": 1400
            }
          ],
          "observed": {
            "packetsRequested": 15,
            "packetsSent": 15,
            "packetsReceivedByReceiver": 15,
            "payloadBytesSent": 3600,
            "payloadBytesReceived": 3600,
            "pc1CapturedEspPackets": 15,
            "pc2CapturedUdpPackets": 15,
            "saCounterDelta": {
              "packetsIn": 0,
              "packetsOut": 15,
              "bytesIn": 0,
              "bytesOut": 4200
            }
          }
        },
        "measurement_path": "9870c4f3-6127-4efe-b661-fe62a5713d21/workload_measurements.json",
        "measurement_sha256": "f9e308ce06a35f7c362564357f8902f16f5bae4faae6fe4fe00aa0114cee50e7"
      },
      "vpn": {
        "requested_configuration": {
          "source": "existing live testbed SA; collector does not reconfigure StrongSwan",
          "ipVersion": "IPv4",
          "mode": "tunnel"
        },
        "effective_configuration": {
          "ike": {
            "version": 2,
            "encryption": "AES_CBC",
            "encryptionKeySize": 256,
            "integrity": "HMAC_SHA2_256_128",
            "prf": "PRF_HMAC_SHA2_256",
            "dhGroup": 14,
            "dhGroupName": "MODP_2048"
          },
          "child": {
            "name": "pc-tunnel",
            "state": "INSTALLED",
            "mode": "TUNNEL",
            "protocol": "ESP",
            "encryption": "AES_GCM_16",
            "encryptionKeySize": 256,
            "integrity": null,
            "pfsGroup": 14,
            "pfsGroupName": "MODP_2048",
            "localTrafficSelector": "172.20.0.2/32",
            "remoteTrafficSelector": "172.20.0.3/32",
            "bytesIn": 0,
            "bytesOut": 0,
            "packetsIn": 0,
            "packetsOut": 0,
            "spiIn": "c83250e2",
            "spiOut": "c06c8f9f"
          },
          "xfrmMode": "TUNNEL"
        },
        "negotiated_sa_evidence_path": "9870c4f3-6127-4efe-b661-fe62a5713d21/negotiated_sa.json",
        "negotiated_sa_evidence_sha256": "dd5cb7f419579b3fa83c759565e6b9b8a50d8942efde7fd161f08ac451f7ed05"
      },
      "data_quality": {
        "status": "accepted",
        "reasons": []
      }
    }
  ]
}