{
  "manifest_version": "vista-strongswan-experiment-v2",
  "dataset_id": "collection-87173593-9085-4c74-9324-59109a180a39",
  "feature_schema_version": "vista-flow-v1",
  "extractor_version": "vista-ml-pcap-features-v1",
  "observations": [
    {
      "experiment_id": "6b503dfa-1b5f-4da5-9047-bf5e770d2561",
      "session_id": "87173593-9085-4c74-9324-59109a180a39",
      "session_record_path": "session_record.json",
      "session_record_sha256": "6180552f9d86028c4b27aa1e0a184c310703a1068ed49b3ee0f359b333d1a329",
      "capture": {
        "path": "packets.csv",
        "format": "packet_table_csv",
        "sha256": "3c6a7763f9dc9ca7f68aed0154b5cb18a60266bf3510fb38a774f7649d6a7dc3",
        "started_at": "2026-10-10T06:33:10.606794+00:00",
        "completed_at": "2026-10-10T06:33:17.581487+00:00",
        "interface": "eth0",
        "capture_point": "outer",
        "ip_version": 4,
        "protocol_family": "ESP",
        "raw_pcap_path": "pc1_outer_icmp.pcap",
        "raw_pcap_format": "pcap",
        "raw_pcap_sha256": "414c12f1a94dd7aa87fe1541b5a4279a946a167a85bca873a57a121107359d79",
        "raw_pcap_size_bytes": 31426
      },
      "ground_truth": {
        "label": "controlled_icmpv4",
        "label_schema_version": "vista-target-label-schema-v1",
        "workload_subtype": "icmpv4_echo",
        "record_path": "ground_truth.json",
        "record_sha256": "1199da988868896c598c45742d7538144ff3b48da8bc558d2c5ccb001b4a935d",
        "record_field": "label",
        "method": "Bounded ICMP echo generated by pc1; independently corroborated by pc2 receiver-side ICMP capture and sender ping counters.",
        "independently_verified": true
      },
      "workload": {
        "type": "icmpv4_echo",
        "subtype": "icmpv4_echo",
        "configuration": {
          "profiles": [
            {
              "count": 7,
              "interval_seconds": 0.8,
              "payload_bytes": 1400
            }
          ],
          "observed": {
            "packetsRequested": 7,
            "packetsSent": 7,
            "packetsReceived": 7,
            "senderDurationSeconds": 5.108999999938533,
            "receiverEchoRequests": 7,
            "receiverEchoReplies": 0,
            "pc2CapturedIcmpPackets": 7,
            "pc1CapturedEspPackets": 14,
            "packetTablePackets": 0,
            "byteCount": 9800,
            "icmpBytesSent": 9856,
            "pc1CapturedIpv4Bytes": 20776,
            "saCounterDelta": {
              "packetsIn": 7,
              "packetsOut": 7,
              "bytesIn": 9996,
              "bytesOut": 9996
            }
          }
        },
        "measurement_path": "workload_measurements.json",
        "measurement_sha256": "0a09387ce2db86d120c2269e0bb89f6ea861b4f4c9079d4cde602d18e5496c45"
      },
      "vpn": {
        "requested_configuration": {
          "source": "existing live testbed SA; collector does not reconfigure StrongSwan",
          "ipVersion": "IPv4",
          "mode": "tunnel"
        },
        "effective_configuration": {
          "ike": {
            "version": 2,
            "encryption": "AES_CBC",
            "encryptionKeySize": 256,
            "integrity": "HMAC_SHA2_256_128",
            "prf": "PRF_HMAC_SHA2_256",
            "dhGroup": 14,
            "dhGroupName": "MODP_2048"
          },
          "child": {
            "name": "pc-tunnel",
            "state": "INSTALLED",
            "mode": "TUNNEL",
            "protocol": "ESP",
            "encryption": "AES_GCM_16",
            "encryptionKeySize": 256,
            "integrity": null,
            "pfsGroup": 14,
            "pfsGroupName": "MODP_2048",
            "localTrafficSelector": "172.20.0.2/32",
            "remoteTrafficSelector": "172.20.0.3/32",
            "bytesIn": 3731,
            "bytesOut": 6514,
            "packetsIn": 47,
            "packetsOut": 56,
            "spiIn": "cf22031d",
            "spiOut": "cd1bf3a0"
          },
          "xfrmMode": "TUNNEL"
        },
        "negotiated_sa_evidence_path": "negotiated_sa.json",
        "negotiated_sa_evidence_sha256": "2e9d8cbc185b453e212866b24fecb5d7943883788659f2306ffdb88f6776857d"
      },
      "data_quality": {
        "status": "accepted",
        "reasons": []
      }
    }
  ]
}