{
  "manifest_version": "vista-strongswan-experiment-v2",
  "dataset_id": "collection-a5df1425-76cb-49ac-a88d-aa9d1e561196",
  "feature_schema_version": "vista-flow-v1",
  "extractor_version": "vista-ml-pcap-features-v1",
  "observations": [
    {
      "experiment_id": "a22c988c-cf23-4e41-84e5-f7dae35bda92",
      "session_id": "a5df1425-76cb-49ac-a88d-aa9d1e561196",
      "session_record_path": "session_record.json",
      "session_record_sha256": "fd58c8c68b687b54ce449816a6e6d382f369185d2ec7a2237452dde7d4bb46b5",
      "capture": {
        "path": "packets.csv",
        "format": "packet_table_csv",
        "sha256": "2c4598da062138ca69cd2142359328548f4bcd1ee401bb5378411c67ceabf2f9",
        "started_at": "2026-10-10T04:05:27.630292+00:00",
        "completed_at": "2026-10-10T04:05:34.020403+00:00",
        "interface": "eth0",
        "capture_point": "outer",
        "ip_version": 4,
        "protocol_family": "ESP",
        "raw_pcap_path": "pc1_outer_tcp.pcap",
        "raw_pcap_format": "pcap",
        "raw_pcap_sha256": "81a511e2ca89c7a63c6c2281212ec98a2c0e787320044432ef037e8ec746433c",
        "raw_pcap_size_bytes": 3310
      },
      "ground_truth": {
        "label": "controlled_tcp_marker",
        "record_path": "ground_truth.json",
        "record_sha256": "d25bd8b10517e4bb9c78023b7f44c0142939861887cdb2cdd3e73a0061f65875",
        "record_field": "label",
        "method": "Bounded deterministic marker bytes sent by pc1 over one TCP connection; pc2 independently records and hashes the received payload.",
        "independently_verified": true
      },
      "workload": {
        "type": "tcp_marker",
        "configuration": {
          "profiles": [
            {
              "count": 5,
              "interval_seconds": 0.8,
              "payload_bytes": 96
            }
          ],
          "observed": {
            "messagesRequested": 5,
            "messagesSent": 5,
            "bytesSent": 480,
            "bytesReceived": 480,
            "durationSeconds": 3.234000000054948,
            "throughputBytesPerSecond": 148.4230055633409,
            "pc1CapturedTcpPackets": 9,
            "pc2CapturedTcpPackets": 9,
            "pc1CapturedEspPackets": 16,
            "pc1CapturedIpv4Bytes": 2224,
            "receiverPayloadSha256": "9b74a9720a326fd5bb9e7b7cbea32e0e8f311de67c55ff7bb3d807ecba6a85e1",
            "saCounterDelta": {
              "packetsIn": 7,
              "packetsOut": 9,
              "bytesIn": 372,
              "bytesOut": 956
            }
          }
        },
        "measurement_path": "workload_measurements.json",
        "measurement_sha256": "5cef5444d4420b3087d46ce99c7e1cd132a90662891a3f90d417341a6c7cdd97"
      },
      "vpn": {
        "requested_configuration": {
          "source": "existing live testbed SA; collector does not reconfigure StrongSwan",
          "ipVersion": "IPv4",
          "mode": "tunnel"
        },
        "effective_configuration": {
          "ike": {
            "version": 2,
            "encryption": "AES_CBC",
            "encryptionKeySize": 256,
            "integrity": "HMAC_SHA2_256_128",
            "prf": "PRF_HMAC_SHA2_256",
            "dhGroup": 14,
            "dhGroupName": "MODP_2048"
          },
          "child": {
            "name": "pc-tunnel",
            "state": "INSTALLED",
            "mode": "TUNNEL",
            "protocol": "ESP",
            "encryption": "AES_GCM_16",
            "encryptionKeySize": 256,
            "integrity": null,
            "pfsGroup": 14,
            "pfsGroupName": "MODP_2048",
            "localTrafficSelector": "172.20.0.2/32",
            "remoteTrafficSelector": "172.20.0.3/32",
            "bytesIn": 0,
            "bytesOut": 0,
            "packetsIn": 0,
            "packetsOut": 0,
            "spiIn": "ccd49a7d",
            "spiOut": "c4d5a10d"
          },
          "xfrmMode": "TUNNEL"
        },
        "negotiated_sa_evidence_path": "negotiated_sa.json",
        "negotiated_sa_evidence_sha256": "a138da22f87f77da70fa4790eaea522f675054c956f0d4b7d71f4ef70dda1450"
      },
      "data_quality": {
        "status": "accepted",
        "reasons": []
      }
    }
  ]
}